{
  "gate": "G1",
  "scope": "specs",
  "timestamp": "2026-10-11T23:57:27Z",
  "result": "pending_human",
  "score": 92.9,
  "threshold": 85,
  "checks": [
    {
      "id": "G1.1",
      "type": "deterministic",
      "hard": true,
      "status": "pass",
      "evidence": [
        "python scripts/feos_validate.py --artifacts specs: PASS, 5 checks"
      ]
    },
    {
      "id": "G1.2",
      "type": "deterministic",
      "hard": true,
      "status": "pass",
      "evidence": [
        "python scripts/feos_trace.py --stage requirements: PASS, 26 checks"
      ]
    },
    {
      "id": "G1.3",
      "type": "deterministic",
      "hard": false,
      "status": "pass",
      "evidence": [
        "python scripts/feos_lint_requirements.py specs/prd.md: PASS, 0 vague terms"
      ]
    },
    {
      "id": "G1.4",
      "type": "agent",
      "hard": true,
      "status": "pass",
      "evidence": [
        "evidence/G1-requirements-rereview.md: every FR has five path classes and all NFRs are measurable"
      ]
    },
    {
      "id": "G1.5",
      "type": "agent",
      "hard": false,
      "status": "pass",
      "evidence": [
        "evidence/G1-requirements-rereview.md: requirements consistent and solution-free"
      ]
    },
    {
      "id": "G1.6",
      "type": "human",
      "hard": true,
      "status": "pending",
      "evidence": [
        "Product owner approval of specs/prd.md is required"
      ]
    }
  ],
  "failed_hard_checks": [],
  "route_to": null
}